{
  "title": "Kiến Trúc Toàn Trình Telegram Stock Bot",
  "category": "HỆ THỐNG PHÁT TÍN HIỆU ĐẦU TƯ TỰ ĐỘNG",
  "subtitle": "Mô hình 5 tầng Clean Architecture: Tự động chuyển đổi dự phòng 3 lớp, Phân tích đồng thuận đa nhân tố (Kỹ thuật + CANSLIM) và Bot Telegram",
  "columns": [
    {
      "id": "col_ingestion",
      "nodes": [
        {
          "id": "direct_dchart",
          "title": "DChart REST API",
          "badge": "< 200MS",
          "color": "sky",
          "width": 210,
          "items": [
            "1. Nến lịch sử & trong phiên",
            "2. Kết nối Direct REST API",
            "3. Khởi động nhanh 1.2s"
          ]
        },
        {
          "id": "kbs_priceboard",
          "title": "KBS Priceboard",
          "badge": "BẢNG GIÁ SỐNG",
          "color": "emerald",
          "width": 210,
          "items": [
            "1. Bảng giá khớp lệnh sống",
            "2. Theo dõi giao dịch Khối ngoại",
            "3. Tự chủ dữ liệu hoàn toàn"
          ]
        }
      ]
    },
    {
      "id": "col_fallback",
      "nodes": [
        {
          "id": "cafef_scraper",
          "title": "CafeF Scraper Dự Phòng",
          "badge": "DỰ PHÒNG",
          "color": "amber",
          "width": 210,
          "items": [
            "1. 4 lớp kỹ thuật chống WAF",
            "2. Xoay vòng Header User-Agent",
            "3. Cơ chế Exponential Backoff"
          ]
        },
        {
          "id": "sqlite_cache",
          "title": "Bộ Đệm SQLite TTL",
          "badge": "BỘ ĐỆM TTL",
          "color": "purple",
          "width": 210,
          "items": [
            "1. Phân tầng TTL 15m / 3m / 24h",
            "2. Bộ đệm an toàn khi mất mạng",
            "3. Không tạo tệp rác trên đĩa"
          ]
        }
      ]
    },
    {
      "id": "col_strategy",
      "nodes": [
        {
          "id": "ta_engine",
          "title": "Phân Tích Kỹ Thuật (TA)",
          "badge": "EMA + RSI",
          "color": "sky",
          "width": 210,
          "items": [
            "1. Điểm giao cắt EMA 20/50",
            "2. RSI 14 Wilder Smoothing",
            "3. Phân kỳ MACD Histogram > 0"
          ]
        },
        {
          "id": "canslim_engine",
          "title": "Tăng Trưởng Cơ Bản (FA)",
          "badge": "CANSLIM SEPA",
          "color": "emerald",
          "width": 210,
          "items": [
            "1. Tỷ suất ROE >= 15%, LNST >= 15%",
            "2. Hệ số Nợ vay / VCSH <= 2.0",
            "3. Khối lượng bùng nổ >= 1.5x MA20"
          ]
        }
      ]
    },
    {
      "id": "col_risk",
      "nodes": [
        {
          "id": "composite_scorer",
          "title": "Đồng Thuận Định Lượng",
          "badge": "ĐIỂM 0-100",
          "color": "amber",
          "width": 210,
          "items": [
            "1. Đồng thuận đa nhân tố TA + FA",
            "2. Phân loại STRONG BUY / BUY / HOLD",
            "3. Quản trị rủi ro tỷ lệ vàng 1:2"
          ]
        },
        {
          "id": "backtest_engine",
          "title": "Kiểm Định Hiệu Năng",
          "badge": "BACKTEST",
          "color": "rose",
          "width": 210,
          "items": [
            "1. Khấu trừ 0.3% thuế & phí môi giới",
            "2. Đo lường tỷ lệ thắng Win Rate %",
            "3. Mức sụt giảm Max Drawdown & PF"
          ]
        }
      ]
    },
    {
      "id": "col_bot",
      "nodes": [
        {
          "id": "telegram_controller",
          "title": "Telegram Bot API",
          "badge": "ASYNC BOT",
          "color": "sky",
          "width": 210,
          "items": [
            "1. Bộ điều khiển Async Bot v20+",
            "2. Nhận diện lệnh tự nhiên /signal",
            "3. Cảnh báo danh mục Watchlist tự động"
          ]
        },
        {
          "id": "chart_renderer",
          "title": "Đồ Thị Nến Nhật RAM",
          "badge": "BYTESIO",
          "color": "emerald",
          "width": 210,
          "items": [
            "1. Vẽ trên bộ nhớ RAM io.BytesIO",
            "2. Kết xuất đồ thị nén trong 0.35s",
            "3. Thẻ khuyến nghị trực quan chuẩn hóa"
          ]
        }
      ]
    }
  ],
  "connections": [
    {
      "from": "direct_dchart",
      "to": "sqlite_cache",
      "color": "sky",
      "animated": true,
      "glow": true
    },
    {
      "from": "direct_dchart",
      "to": "cafef_scraper",
      "color": "amber",
      "animated": true
    },
    {
      "from": "kbs_priceboard",
      "to": "sqlite_cache",
      "color": "emerald",
      "animated": true
    },
    {
      "from": "cafef_scraper",
      "to": "ta_engine",
      "color": "amber",
      "animated": true
    },
    {
      "from": "sqlite_cache",
      "to": "ta_engine",
      "color": "sky",
      "animated": true
    },
    {
      "from": "sqlite_cache",
      "to": "canslim_engine",
      "color": "emerald",
      "animated": true
    },
    {
      "from": "ta_engine",
      "to": "composite_scorer",
      "color": "sky",
      "animated": true
    },
    {
      "from": "canslim_engine",
      "to": "composite_scorer",
      "color": "emerald",
      "animated": true
    },
    {
      "from": "ta_engine",
      "to": "backtest_engine",
      "color": "rose",
      "animated": false
    },
    {
      "from": "canslim_engine",
      "to": "backtest_engine",
      "color": "rose",
      "animated": false
    },
    {
      "from": "composite_scorer",
      "to": "telegram_controller",
      "color": "amber",
      "animated": true
    },
    {
      "from": "composite_scorer",
      "to": "chart_renderer",
      "color": "sky",
      "animated": true
    },
    {
      "from": "backtest_engine",
      "to": "telegram_controller",
      "color": "rose",
      "animated": true
    },
    {
      "from": "backtest_engine",
      "to": "chart_renderer",
      "color": "emerald",
      "animated": false
    }
  ]
}