{
  "title": "Kiến Trúc Toàn Trình Vietnam Stock Real-Time Heatmap",
  "category": "HẠ TẦNG XỬ LÝ DÒNG TIỀN VẬN HÀNH THỰC TẾ",
  "subtitle": "Quy trình xác thực RSA, Luồng SignalR 2.500+ tick/giây, Bộ nhớ đệm RAM Store O(1) và Bản đồ nhiệt Treemap ECharts",
  "columns": [
    {
      "id": "col_auth",
      "nodes": [
        {
          "id": "ssi_vault",
          "title": "Xác Thực Bảo Mật SSI",
          "badge": "KHÓA RSA",
          "color": "purple",
          "width": 210,
          "items": [
            "1. Đọc khóa cấu hình config.json",
            "2. Ký số bảo mật RSA PrivateKey",
            "3. Tự động cấp và gia hạn Token"
          ]
        },
        {
          "id": "sliding_fetcher",
          "title": "Bộ Quét Lùi Snapshot",
          "badge": "LÙI 10 NGÀY",
          "color": "sky",
          "width": 210,
          "items": [
            "1. Quét lùi 10 ngày tránh kỳ nghỉ",
            "2. Nạp snapshot giá tham chiếu",
            "3. Cơ chế dự phòng VNDirect finfo"
          ]
        }
      ]
    },
    {
      "id": "col_stream",
      "nodes": [
        {
          "id": "signalr_worker",
          "title": "Bộ Kết Nối SignalR",
          "badge": "WORKER",
          "color": "sky",
          "width": 210,
          "items": [
            "1. Lắng nghe trực tiếp kênh X:ALL",
            "2. Lắng nghe trực tiếp kênh MI:ALL",
            "3. Tự động kết nối lại khi rớt mạng"
          ]
        },
        {
          "id": "packet_parser",
          "title": "Bộ Giải Mã Gói Tin",
          "badge": "GIẢI MÃ",
          "color": "emerald",
          "width": 210,
          "items": [
            "1. Giải mã gói tin khớp lệnh X & M",
            "2. Tính toán % theo giá tham chiếu",
            "3. Chuẩn hóa dữ liệu đẩy sang RAM"
          ]
        }
      ]
    },
    {
      "id": "col_state",
      "nodes": [
        {
          "id": "ram_store",
          "title": "Bộ Nhớ Đệm RAM Store",
          "badge": "O(1) MUTEX",
          "color": "sky",
          "width": 210,
          "items": [
            "1. Bảng băm Hash-Map 700+ mã CP",
            "2. Cơ chế khóa Thread-Safe Mutex",
            "3. Thời gian truy xuất siêu tốc < 0.12ms"
          ]
        },
        {
          "id": "sector_classifier",
          "title": "Phân Loại 15 Ngành",
          "badge": "VS-SECTOR",
          "color": "amber",
          "width": 210,
          "items": [
            "1. Chuẩn hóa phân loại 15 nhóm ngành",
            "2. Sắp xếp diện tích theo thanh khoản",
            "3. Bảng màu biên độ 5 cấp tài chính"
          ]
        }
      ]
    },
    {
      "id": "col_server",
      "nodes": [
        {
          "id": "aiohttp_server",
          "title": "Máy Chủ Web aiohttp",
          "badge": "CỔNG 8050",
          "color": "emerald",
          "width": 210,
          "items": [
            "1. Tự động giải phóng cổng xung đột",
            "2. Cơ chế ngắt tiến trình sạch SIGINT",
            "3. Cung cấp API Snapshot toàn diện"
          ]
        },
        {
          "id": "dual_dispatcher",
          "title": "Bộ Phát Sóng Kép",
          "badge": "WEBSOCKET",
          "color": "purple",
          "width": 210,
          "items": [
            "1. Kết nối WebSocket FastConnect",
            "2. Phát sóng delta ticks vi sai 60 FPS",
            "3. Khởi động nguội 0ms tức thời"
          ]
        }
      ]
    },
    {
      "id": "col_ui",
      "nodes": [
        {
          "id": "echarts_treemap",
          "title": "Bản Đồ Nhiệt Treemap",
          "badge": "ECHARTS 5.4",
          "color": "sky",
          "width": 210,
          "items": [
            "1. Căn giữa trọng tâm ZRender Hook",
            "2. Tự ẩn nhãn ô diện tích nhỏ < 38px",
            "3. Hiệu ứng chớp Flash khi khớp lệnh"
          ]
        },
        {
          "id": "responsive_drawer",
          "title": "Ngăn Kéo Bảng Soi",
          "badge": "BẢNG SOI",
          "color": "amber",
          "width": 210,
          "items": [
            "1. Thước đo độ rộng 3 màu trực quan",
            "2. Top 6 ngành thu hút dòng tiền",
            "3. Bảng soi chi tiết theo con trỏ chuột"
          ]
        }
      ]
    }
  ],
  "connections": [
    {
      "from": "ssi_vault",
      "to": "signalr_worker",
      "color": "purple",
      "animated": true
    },
    {
      "from": "sliding_fetcher",
      "to": "packet_parser",
      "color": "sky",
      "animated": false
    },
    {
      "from": "signalr_worker",
      "to": "ram_store",
      "color": "sky",
      "animated": true,
      "glow": true
    },
    {
      "from": "packet_parser",
      "to": "ram_store",
      "color": "emerald",
      "animated": true
    },
    {
      "from": "ram_store",
      "to": "sector_classifier",
      "color": "sky",
      "animated": true
    },
    {
      "from": "ram_store",
      "to": "aiohttp_server",
      "color": "emerald",
      "animated": true
    },
    {
      "from": "sector_classifier",
      "to": "dual_dispatcher",
      "color": "amber",
      "animated": true
    },
    {
      "from": "ram_store",
      "to": "dual_dispatcher",
      "color": "purple",
      "animated": true,
      "glow": true
    },
    {
      "from": "aiohttp_server",
      "to": "echarts_treemap",
      "color": "emerald",
      "animated": true
    },
    {
      "from": "dual_dispatcher",
      "to": "echarts_treemap",
      "color": "purple",
      "animated": true,
      "glow": true
    },
    {
      "from": "dual_dispatcher",
      "to": "responsive_drawer",
      "color": "amber",
      "animated": true
    }
  ]
}